<?xml version="1.0" encoding="UTF-8"?>
<personInformation xmlns="http://www.example.org/person"
	xsi:schemaLocation="http://www.example.org/person person.xsd"
	xmlns:xsi="http://www.w3.org/2001/XMLSchema-instance"
	>
	<firstName>123</firstName>
	<middleInitial>BB</middleInitial>
	<lastName>Tamrakar</lastName>
	<streetAddress>24913 Earlsford Dr</streetAddress>
	<city>Chantilly</city>
	<state>VA</state>
	<zip>20152</zip>
</personInformation>